{
  "meta": {
    "market_date": "2026-08-28",
    "generated_at": "2026-08-30T16:32:37.306806+07:00",
    "timezone": "Asia/Bangkok",
    "status": "final",
    "schema_version": "1.1.0"
  },
  "indices": {
    "KOSPI": {
      "name": "코스피",
      "ticker": "^KS11",
      "close": 6788.88,
      "current": 6788.88,
      "change": -123.48999999999978,
      "change_pct": -1.786507377353929,
      "open": 6846.54,
      "high": 6901.78,
      "low": 6780.13,
      "previous_close": 6912.37,
      "source_date": "2026-08-28",
      "as_of": "2026-08-28",
      "retrieved_at": "2026-08-28T14:05:03.801645+07:00",
      "data_state": "final_close",
      "is_cached": false,
      "source": "네이버 금융 지수 일봉 · KRX 원천"
    },
    "KOSDAQ": {
      "name": "코스닥",
      "ticker": "^KQ11",
      "close": 838.41,
      "current": 838.41,
      "change": 0.7599999999999909,
      "change_pct": 0.09073001850414743,
      "open": 835.23,
      "high": 840.85,
      "low": 829.59,
      "previous_close": 837.65,
      "source_date": "2026-08-28",
      "as_of": "2026-08-28",
      "retrieved_at": "2026-08-28T14:05:03.805587+07:00",
      "data_state": "final_close",
      "is_cached": false,
      "source": "네이버 금융 지수 일봉 · KRX 원천"
    },
    "NASDAQ": {
      "name": "나스닥 종합",
      "ticker": "^IXIC",
      "close": 26541.349609375,
      "current": 26541.352,
      "change": 411.15278124999895,
      "change_pct": 1.5734774075314817,
      "open": 26356.98046875,
      "high": 26553.900390625,
      "low": 26273.869140625,
      "previous_close": 26130.19921875,
      "source_date": "2026-08-27",
      "as_of": "2026-08-27",
      "retrieved_at": "2026-08-28T14:05:03.617353+07:00",
      "data_state": "final_close",
      "is_cached": false,
      "source": "Yahoo Finance · ^IXIC"
    },
    "DOW": {
      "name": "다우존스",
      "ticker": "^DJI",
      "close": 53569.44140625,
      "current": 53569.44,
      "change": 105.56109375000233,
      "change_pct": 0.19744376186229556,
      "open": 53613.66015625,
      "high": 53707.62109375,
      "low": 53345.62109375,
      "previous_close": 53463.87890625,
      "source_date": "2026-08-27",
      "as_of": "2026-08-27",
      "retrieved_at": "2026-08-28T14:05:03.624412+07:00",
      "data_state": "final_close",
      "is_cached": false,
      "source": "Yahoo Finance · ^DJI"
    },
    "SP500": {
      "name": "S&P 500",
      "ticker": "^GSPC",
      "close": 7730.990234375,
      "current": 7730.99,
      "change": 55.28980468749978,
      "change_pct": 0.7203226191828714,
      "open": 7710.33984375,
      "high": 7741.27001953125,
      "low": 7689.89013671875,
      "previous_close": 7675.7001953125,
      "source_date": "2026-08-27",
      "as_of": "2026-08-27",
      "retrieved_at": "2026-08-28T14:05:03.612252+07:00",
      "data_state": "final_close",
      "is_cached": false,
      "source": "Yahoo Finance · ^GSPC"
    }
  },
  "rates_fx_volatility": {
    "SOX": {
      "name": "필라델피아 반도체",
      "ticker": "^SOX",
      "close": 11882.169921875,
      "current": 11882.169,
      "change": 270.92876562499987,
      "change_pct": 2.3333318418726456,
      "open": 11870.16015625,
      "high": 11910.0302734375,
      "low": 11690.1904296875,
      "previous_close": 11611.240234375,
      "source_date": "2026-08-27",
      "as_of": "2026-08-27",
      "retrieved_at": "2026-08-28T14:05:03.623411+07:00",
      "data_state": "final_close",
      "is_cached": false,
      "source": "Yahoo Finance · ^SOX"
    },
    "VIX": {
      "name": "VIX 변동성",
      "ticker": "^VIX",
      "close": 14.510000228881836,
      "current": 14.510000228881836,
      "change": -0.6999998092651367,
      "change_pct": -4.602234105914029,
      "open": 14.920000076293945,
      "high": 15.130000114440918,
      "low": 14.420000076293945,
      "previous_close": 15.210000038146973,
      "source_date": "2026-08-27",
      "as_of": "2026-08-27",
      "retrieved_at": "2026-08-28T14:05:03.806587+07:00",
      "data_state": "final_close",
      "is_cached": false,
      "source": "Yahoo Finance · ^VIX"
    },
    "US10Y": {
      "name": "미국 국채 10년",
      "ticker": "^TNX",
      "close": 4.671999931335449,
      "current": 4.672,
      "change": 0.007999965667724318,
      "change_pct": 0.1715258492460461,
      "open": 4.6579999923706055,
      "high": 4.679999828338623,
      "low": 4.64900016784668,
      "previous_close": 4.664000034332275,
      "source_date": "2026-08-27",
      "as_of": "2026-08-27",
      "retrieved_at": "2026-08-28T14:05:03.806587+07:00",
      "data_state": "final_close",
      "is_cached": false,
      "source": "Yahoo Finance · ^TNX"
    },
    "USDKRW": {
      "name": "원/달러",
      "ticker": "KRW=X",
      "close": 1372.5,
      "current": 1372.65,
      "change": -7.949999999999818,
      "change_pct": -0.5758365927857322,
      "open": 1380.1600341796875,
      "high": 1381.93994140625,
      "low": 1371.3800048828125,
      "previous_close": 1380.6,
      "source_date": "2026-08-28",
      "as_of": "2026-08-28T15:30:00+09:00",
      "retrieved_at": "2026-08-28T14:05:05.592114+07:00",
      "data_state": "intraday",
      "is_cached": false,
      "source": "네이버 금융 하나은행 15:30 회차별 매매기준율 + Yahoo 현재가 · KRW=X"
    },
    "JPYKRW": {
      "name": "원/100엔",
      "ticker": "JPYKRW=X",
      "close": 860.64,
      "current": 858.4,
      "change": -7.99000000000003,
      "change_pct": -0.9222174771176989,
      "open": 863.8999938964844,
      "high": 864.799976348877,
      "low": 857.9000473022461,
      "previous_close": 866.39,
      "source_date": "2026-08-28",
      "as_of": "2026-08-28T15:30:00+09:00",
      "retrieved_at": "2026-08-28T14:05:05.476968+07:00",
      "data_state": "intraday",
      "is_cached": false,
      "source": "네이버 금융 하나은행 15:30 회차별 매매기준율 + Yahoo 현재가 · JPYKRW=X"
    },
    "DXY": {
      "name": "달러인덱스",
      "ticker": "DX-Y.NYB",
      "close": 99.15699768066406,
      "current": 99.157,
      "change": -0.0030036621093785243,
      "change_pct": -0.003029106492990451,
      "open": 99.11399841308594,
      "high": 99.2040023803711,
      "low": 99.10199737548828,
      "previous_close": 99.16000366210938,
      "source_date": "2026-08-28",
      "as_of": "2026-08-28",
      "retrieved_at": "2026-08-28T14:05:03.995467+07:00",
      "data_state": "intraday",
      "is_cached": false,
      "source": "Yahoo Finance · DX-Y.NYB"
    }
  },
  "commodities_crypto": {
    "WTI": {
      "name": "WTI 원유",
      "ticker": "CL=F",
      "close": 82.87000274658203,
      "current": 82.87,
      "change": -0.6599987792968705,
      "change_pct": -0.7901338308895712,
      "open": 83.66999816894531,
      "high": 83.77999877929688,
      "low": 82.73999786376953,
      "previous_close": 83.52999877929688,
      "source_date": "2026-08-28",
      "as_of": "2026-08-28",
      "retrieved_at": "2026-08-28T14:05:03.987465+07:00",
      "data_state": "intraday",
      "is_cached": false,
      "source": "Yahoo Finance · CL=F"
    },
    "GOLD": {
      "name": "국제 금",
      "ticker": "GC=F",
      "close": 4657.2001953125,
      "current": 4657.2,
      "change": 47.49980468749982,
      "change_pct": 1.030431539469775,
      "open": 4656.0,
      "high": 4664.7998046875,
      "low": 4623.0,
      "previous_close": 4609.7001953125,
      "source_date": "2026-08-28",
      "as_of": "2026-08-28",
      "retrieved_at": "2026-08-28T14:05:03.991468+07:00",
      "data_state": "intraday",
      "is_cached": false,
      "source": "Yahoo Finance · GC=F"
    },
    "BITCOIN": {
      "name": "비트코인",
      "ticker": "BTC-USD",
      "close": 79776.078125,
      "current": 79776.08,
      "change": 748.6581250000017,
      "change_pct": 0.9473396793636725,
      "open": 80261.859375,
      "high": 81148.5078125,
      "low": 79573.96875,
      "previous_close": 79027.421875,
      "source_date": "2026-08-28",
      "as_of": "2026-08-28",
      "retrieved_at": "2026-08-28T14:05:03.993467+07:00",
      "data_state": "intraday",
      "is_cached": false,
      "source": "Yahoo Finance · BTC-USD"
    }
  },
  "krx_investor_trading": {
    "unit": "KRW billion",
    "markets": {
      "KOSPI": {
        "source_date": "2026-08-28",
        "as_of": "2026-08-28T16:05:10+09:00",
        "data_state": "확정",
        "investors": {
          "기관": {
            "sell": 5894,
            "buy": 5610,
            "net_buy": -284
          },
          "외국인": {
            "sell": 7400,
            "buy": 5644,
            "net_buy": -1756
          },
          "개인": {
            "sell": 6519,
            "buy": 6943,
            "net_buy": 424
          }
        }
      },
      "KOSDAQ": {
        "source_date": "2026-08-28",
        "as_of": "2026-08-28T16:05:11+09:00",
        "data_state": "확정",
        "investors": {
          "기관": {
            "sell": 473,
            "buy": 469,
            "net_buy": -3
          },
          "외국인": {
            "sell": 1394,
            "buy": 1300,
            "net_buy": -94
          },
          "개인": {
            "sell": 3036,
            "buy": 3135,
            "net_buy": 98
          }
        }
      },
      "KOSPI200선물": {
        "source_date": "2026-08-28",
        "as_of": "2026-08-28T16:05:12+09:00",
        "data_state": "확정",
        "investors": {
          "기관": {
            "sell": 4058,
            "buy": 3298,
            "net_buy": -760
          },
          "외국인": {
            "sell": 21737,
            "buy": 22350,
            "net_buy": 614
          },
          "개인": {
            "sell": 4352,
            "buy": 4504,
            "net_buy": 152
          }
        }
      }
    }
  },
  "recent_5d_flows": {
    "unit": "KRW billion",
    "used_trading_days": 5,
    "start_date": "2026-08-24",
    "end_date": "2026-08-28",
    "markets": {
      "KOSPI": {
        "외국인": -9229,
        "기관": 537,
        "개인": 643
      },
      "KOSDAQ": {
        "외국인": 485,
        "기관": -186,
        "개인": -281